,good,bad
820,"""Fifty miles?  Oh, dear Pigeon, how I wish I had your wings!""","""Fifty miles?  Oh, dear Pigeon, how I wish I had your wi"
821,"""If you want to come, I'll take you with me.""","""If you "
822,"""How?""","""Ho"
823,"""Astride my back.  Are you very heavy?""","""Astride my back.  Are you very h"
824,"""Heavy?  Not at all.  I'm only a feather.""","""Heavy?  Not at all.  I'm o"
825,"""Very well.""","""Very we"
826,"Saying nothing more, Pinocchio jumped on the Pigeon'sback and, as he settled himself, he cried out gayly:","Saying nothing more, Pinocchio jumped on "
827,"""Gallop on, gallop on, my pretty steed!  I'm in a great hurry.""","""Gallop on, gallop on, my pretty steed!  I'm in a great"
828,"The Pigeon flew away, and in a few minutes he hadreached the clouds.  The Marionette looked to see whatwas below them.  His head swam and he was so frightenedthat he clutched wildly at the Pigeon's neck to keephimself from falling.","The Pigeon flew away, and in a few minutes he hadreached the clouds.  The Marionette looked to see wha"
829,They flew all day.  Toward evening the Pigeon said:,They flew all day. 
830,"""I'm very thirsty!""","""I'"
831,"""And I'm very hungry!"" said Pinocchio.","""And I'm very hungr"
832,"""Let us stop a few minutes at that pigeon coop down there.Then we can go on and be at the seashore in the morning.""","""Let us stop a few minutes at that pigeon coop down there.Then we can g"
833,They went into the empty coop and there they found nothing buta bowl of water and a small basket filled with chick-peas.,They went into the empty coop and there they found nothing buta bowl of 
834,"The Marionette had always hated chick-peas.  Accordingto him, they had always made him sick; but that nighthe ate them with a relish.  As he finished them, he turnedto the Pigeon and said:","The Marionette had always hated chick-peas.  Accordingto him, they had always "
835,"""I never should have thought that chick-peas could be so good!""","""I never should have thou"
836,"""You must remember, my boy,"" answered the Pigeon,""that hunger is the best sauce!""","""You must remember, my boy,"" answered the"
837,"After resting a few minutes longer, they set out again.The next morning they were at the seashore.","After resting a few minutes longer, they set out again.The next morning "
838,"Pinocchio jumped off the Pigeon's back, and the Pigeon,not wanting any thanks for a kind deed, flew away swiftlyand disappeared.","Pinocchio jumped off the Pigeon's back, and the Pigeon,not wanting any thanks for a kind deed, flew awa"
839,"The shore was full of people, shrieking and tearing theirhair as they looked toward the sea.","The shore was full of people, shrieking and tearing theirhair as they looked toward the"
840,"""What has happened?"" asked Pinocchio of a little old woman.","""What has happened?"" asked Pinocchio of a"
841,"""A poor old father lost his only son some time ago andtoday he built a tiny boat for himself in order to go insearch of him across the ocean.  The water is very roughand we're afraid he will be drowned.""","""A poor old father lost his only son some time ago andtoday he built a tiny boat for himself in order to go insearch of him across the ocean.  The water is very roughand we're afraid he will be "
842,"""Where is the little boat?""","""Where is"
843,"""There.  Straight down there,"" answered the little old woman,pointing to a tiny shadow, no bigger than a nutshell,floating on the sea.","""There.  Straight down there,"" answered the "
844,Pinocchio looked closely for a few minutes and then gave a sharp cry:,Pinocchio looked closely for a few minutes and then gave 
845,"""It's my father!  It's my father!""","""It's my fat"
846,"Meanwhile, the little boat, tossed about by the angrywaters, appeared and disappeared in the waves.  And Pinocchio,standing on a high rock, tired out with searching,waved to him with hand and cap and even with his nose.","Meanwhile, the little boat, tossed about by the angrywaters, appeared an"
847,"It looked as if Geppetto, though far away from theshore, recognized his son, for he took off his cap andwaved also.  He seemed to be trying to make everyoneunderstand that he would come back if he were able, butthe sea was so heavy that he could do nothing with his oars.Suddenly a huge wave came and the boat disappeared.","It looked as if Geppetto, though far away from theshore, recognized his son, for he took off his cap andwaved also.  He seemed to be trying to make everyoneunderstand that he would come back if he were able, butthe sea was so heavy that he could do nothing with his oars.Suddenly a huge wave came and the bo"
848,"They waited and waited for it, but it was gone.","They waited and waited for it, "
849,"""Poor man!"" said the fisher folk on the shore, whisperinga prayer as they turned to go home.","""Poor "
850,"Just then a desperate cry was heard.  Turning around,the fisher folk saw Pinocchio dive into the sea and heardhim cry out:","Just then a desperate cry was heard.  Turning around,the fisher folk saw "
851,"""I'll save him!  I'll save my father!""","""I'll save him! "
852,"The Marionette, being made of wood, floated easilyalong and swam like a fish in the rough water.  Now andagain he disappeared only to reappear once more.  In atwinkling, he was far away from land.  At last he wascompletely lost to view.","The Marionette, being made of wood, floated easilyalong and swam like a fish in the rough water.  Now andagain he disappeared only to reappear once more.  In atwinkling, he was far away from land.  At last he wascompletely los"
853,"""Poor boy!"" cried the fisher folk on the shore, and againthey mumbled a few prayers, as they returned home.","""Poor boy!"" cried the fisher folk on the shore, a"
854,CHAPTER 24,CH
855,Pinocchio reaches the Island of the Busy Beesand finds the Fairy once more,Pinocchio reaches 
856,"Pinocchio, spurred on by the hope of finding his fatherand of being in time to save him, swam all night long.","Pinocchio, spurred on by the hope of finding his fatherand of be"
857,"And what a horrible night it was!  It poured rain, ithailed, it thundered, and the lightning was so bright that itturned the night into day.","And what a horrible night it was!  It poured rain, ithailed, it thundered, and the lightning was so bright that itturned the "
858,"At dawn, he saw, not far away from him, a long stretchof sand.  It was an island in the middle of the sea.","At dawn, h"
859,"Pinocchio tried his best to get there, but he couldn't.The waves played with him and tossed him about as if hewere a twig or a bit of straw.  At last, and luckily for him,a tremendous wave tossed him to the very spot where hewanted to be.  The blow from the wave was so strong that,as he fell to the ground, his joints cracked and almost broke.But, nothing daunted, he jumped to his feet and cried:","Pinocchio tried his best to get there, but he couldn't.The waves played with him and tossed him about as if hewere a twig or a bit of straw.  At last, and luckily for him,a tremendous wave tossed him to the very spot where hewanted to be.  The blow from the wave was so strong that,as he fell to the ground, his joints cracked and almost broke.But, nothing daunted, he jumped to his feet "
860,"""Once more I have escaped with my life!""","""Once more I have escaped with "
861,Little by little the sky cleared.  The sun came out in fullsplendor and the sea became as calm as a lake.,Little by little the sky cleared.  The sun came out in fullsplendor a
862,"Then the Marionette took off his clothes and laid themon the sand to dry.  He looked over the waters to seewhether he might catch sight of a boat with a little man init.  He searched and he searched, but he saw nothing exceptsea and sky and far away a few sails, so small that theymight have been birds.","Then the Marionette took off his clothes and laid themon the sand to dry.  He looked over the waters to seewhether he might catch sight of a boat with a little man init.  He searched and he searched, but he saw nothing exceptsea and sky and far away a"
863,"""If only I knew the name of this island!"" he said to himself.""If I even knew what kind of people I would find here!But whom shall I ask?  There is no one here.""","""If only I knew the name of this island!"" he said to himself.""If I even knew what kind of people I would fin"
864,"The idea of finding himself in so lonesome a spot made himso sad that he was about to cry, but just then he saw a bigFish swimming near-by, with his head far out of the water.",The idea of finding himself in so lonesome a spot made hi
865,"Not knowing what to call him, the Marionette said to him:",Not knowing 
866,"""Hey there, Mr. Fish, may I have a word with you?""","""Hey there, Mr. Fish, may I have "
867,"""Even two, if you want,"" answered the fish,who happened to be a very polite Dolphin.","""Even two, if you want,"" answered the fish,who happened "
868,"""Will you please tell me if, on this island, there areplaces where one may eat without necessarily being eaten?""","""W"
869,"""Surely, there are,"" answered the Dolphin.  ""In factyou'll find one not far from this spot.""","""Surely, there are,"" answered the Dolphin.  "
870,"""And how shall I get there?""","""And how shall "
871,"""Take that path on your left and follow your nose.  Youcan't go wrong.""","""Take that path on your left and follow your nose.  Youca"
872,"""Tell me another thing.  You who travel day and nightthrough the sea, did you not perhaps meet a little boat withmy father in it?""","""Tell me another thing.  You who travel day and nightthrough the sea, did you not perhaps m"
873,"""And who is you father?""","""And who is"
874,"""He is the best father in the world, even as I am theworst son that can be found.""","""He is the best father in the wo"
875,"""In the storm of last night,"" answered the Dolphin, ""thelittle boat must have been swamped.""","""In the storm of last night,"" answered the Dolphin, ""thelittle "
876,"""And my father?""","""And"
877,"""By this time, he must have been swallowed by theTerrible Shark, which, for the last few days, has beenbringing terror to these waters.""","""By this time, "
878,"""Is this Shark very big?"" asked Pinocchio, who wasbeginning to tremble with fright.","""Is this Shark very bi"
879,"""Is he big?"" replied the Dolphin.  ""Just to give you an ideaof his size, let me tell you that he is larger than a fivestory building and that he has a mouth so big and so deep,that a whole train and engine could easily get into it.""","""Is he big?"" replied the Dolphin.  ""Just to give you an ideaof his size, let me tell you that he is larger than a five"
880,"""Mother mine!"" cried the Marionette, scared to death;and dressing himself as fast as he could, he turned to theDolphin and said:","""Mother mine!"" cried the Marionette, scared to death;and dressing h"
881,"""Farewell, Mr. Fish.  Pardon the bother, and many thanksfor your kindness.""","""Farewell, Mr. Fish.  Pardon the bother, and many thanksfor your kindness"
882,"This said, he took the path at so swift a gait that heseemed to fly, and at every small sound he heard,he turned in fear to see whether the Terrible Shark,five stories high and with a train in his mouth,was following him.","This said, he to"
883,"After walking a half hour, he came to a small countrycalled the Land of the Busy Bees.  The streets were filledwith people running to and fro about their tasks.  Everyoneworked, everyone had something to do.  Even if one wereto search with a lantern, not one idle man or one trampcould have been found.","After walking a half hour, he came to a small countrycalled the Land of the Busy Bees.  The streets were filledwith people running to a"
884,"""I understand,"" said Pinocchio at once wearily,""this is no place for me!  I was not born for work.""","""I understand,"" said Pinocchio at once wearily,""this is no "
885,"But in the meantime, he began to feel hungry, for itwas twenty-four hours since he had eaten.","But in the meantime, he began to feel hungry, for itw"
886,What was to be done?,Wha
887,There were only two means left to him in order to get abite to eat.  He had either to work or to beg.,There were only two means left to him in order to get abite to 
888,"He was ashamed to beg, because his father had alwayspreached to him that begging should be done only by thesick or the old.  He had said that the real poor in this world,deserving of our pity and help, were only those who, eitherthrough age or sickness, had lost the means of earning theirbread with their own hands.  All others should work, andif they didn't, and went hungry, so much the worse for them.","He was ashamed to beg, becau"
889,"Just then a man passed by, worn out and wet with perspiration,pulling, with difficulty, two heavy carts filled with coal.","Just then a man passed by, worn out and wet with perspiration,pulling, with diffi"
890,"Pinocchio looked at him and, judging him by his looksto be a kind man, said to him with eyes downcast in shame:","Pinocchio looked at him and, judging him by his looksto be a kind man, said to him with eyes downcast i"
891,"""Will you be so good as to give me a penny,for I am faint with hunger?""","""Will"
892,"""Not only one penny,"" answered the Coal Man.  ""I'll giveyou four if you will help me pull these two wagons.""","""Not only one penny,"" answered the Coal Man.  ""I'll giveyou fo"
893,"""I am surprised!"" answered the Marionette, very much offended.""I wish you to know that I never have been a donkey,nor have I ever pulled a wagon.""","""I am surprised!"" answered the Marionette, very much offended.""I wish you to know that I never"
894,"""So much the better for you!"" answered the Coal Man.""Then, my boy, if you are really faint with hunger,eat two slices of your pride; and I hope they don'tgive you indigestion.""","""So much the better for you!"" answered the Coal Man.""Then, my boy, if you are really faint with hunger,eat two slices of"
895,"A few minutes after, a Bricklayer passed by, carryinga pail full of plaster on his shoulder.","A few minutes after, a Bricklayer passed by, carryinga pail"
896,"""Good man, will you be kind enough to give a penny toa poor boy who is yawning from hunger?""","""Good man, will you be kind enou"
897,"""Gladly,"" answered the Bricklayer.  ""Come with me and carrysome plaster, and instead of one penny, I'll give you five.""","""Gladly,"" answered the Bricklayer.  ""Come with me and carrysome plaster, and instead of one p"
898,"""But the plaster is heavy,"" answered Pinocchio, ""and thework too hard for me.""","""But the plaster is heavy,"
899,"""If the work is too hard for you, my boy, enjoy your yawnsand may they bring you luck!""","""If the work is too hard for you, my boy, enjoy your"
900,"In less than a half hour, at least twenty people passedand Pinocchio begged of each one, but they all answered:",In l
901,"""Aren't you ashamed?  Instead of being a beggar in the streets,why don't you look for work and earn your own bread?""","""Aren't you ashamed?  Instead of being a beggar in the streets"
902,Finally a little woman went by carrying two water jugs.,Finally a little woman we
903,"""Good woman, will you allow me to have a drink fromone of your jugs?"" asked Pinocchio, who was burning upwith thirst.","""Good woman, will you allow me to have a drink fromone of your jugs?"" asked Pinocchio, who was burning upwith t"
904,"""With pleasure, my boy!"" she answered, setting thetwo jugs on the ground before him.","""With pleasu"
905,"When Pinocchio had had his fill, he grumbled,as he wiped his mouth:","When Pinocchio had had his fill, he gr"
906,"""My thirst is gone.  If I could only as easily get rid of my hunger!""","""My thirst is gone. "
907,"On hearing these words, the good little woman immediately said:",On heari
908,"""If you help me to carry these jugs home, I'll give you aslice of bread.""","""If you help me to carry these jugs home,"
909,Pinocchio looked at the jug and said neither yes nor no.,Pinocchio looked at the jug and said ne
910,"""And with the bread, I'll give you a nice dish ofcauliflower with white sauce on it.""","""And with the bread, "
911,Pinocchio gave the jug another look and said neither yes nor no.,Pinocchio gave the ju
912,"""And after the cauliflower, some cake and jam.""","""And after the cauliflower, some c"
913,"At this last bribery, Pinocchio could no longer resist and said firmly:","At this last bribery, Pinocchio could no longer resist"
914,"""Very well.  I'll take the jug home for you.""","""Very well."
915,"The jug was very heavy, and the Marionette, not beingstrong enough to carry it with his hands, had to put iton his head.","The jug was very heavy, and the Marionette, not beingstrong enough to carry it with his hands, had to pu"
916,"When they arrived home, the little woman made Pinocchiosit down at a small table and placed before him thebread, the cauliflower, and the cake.  Pinocchio did not eat;he devoured.  His stomach seemed a bottomless pit.","When they arrived home, the little woman made Pinocchiosit down at a small table and placed before him thebread, the cauliflower, and the cake.  Pinocchio did not eat;he devoured.  His stomach seemed a bott"
917,"His hunger finally appeased, he raised his head to thankhis kind benefactress.  But he had not looked at her longwhen he gave a cry of surprise and sat there with his eyeswide open, his fork in the air, and his mouth filled withbread and cauliflower.","His hunger finally appeased, he raised his head to thankhis kind benefactress.  But he had not looked at her longwhen he gave a cry of surprise and sat there with his eyeswide open, his fork in the air, and his mouth fil"
918,"""Why all this surprise?"" asked the good woman, laughing.","""Why all this surp"
919,"""Because--"" answered Pinocchio, stammering and stuttering,""because--you look like--you remind me of--yes, yes,the same voice, the same eyes, the same hair--yes, yes,yes, you also have the same azure hair she had--Oh, mylittle Fairy, my little Fairy!  Tell me that it is you!Don't make me cry any longer!  If you only knew!  I havecried so much, I have suffered so!""","""Because--"" answered Pinocchio, stammering and stuttering,""because--you look like--you remind me of--yes, yes,the same voice, the same eyes, "
920,And Pinocchio threw himself on the floor and claspedthe knees of the mysterious little woman.,And Pinocchio threw himself on the floor and claspedthe knees of the myste
921,CHAPTER 25,CH
922,"Pinocchio promises the Fairy to be good and to study,as he is growing tired of being a Marionette,and wishes to become a real boy","Pinocchio promises the Fairy to be good and to study,as he is growing tired of "
923,"If Pinocchio cried much longer, the little woman thoughthe would melt away, so she finally admitted that she wasthe little Fairy with Azure Hair.","If Pinocchio cried much longer, the little woman thoughthe would mel"
924,"""You rascal of a Marionette!  How did you know it was I?""she asked, laughing.","""You ras"
925,"""My love for you told me who you were.""","""My love for you told "
926,"""Do you remember?  You left me when I was a little girland now you find me a grown woman.  I am so old, I couldalmost be your mother!""","""Do you remember?  You left m"
927,"""I am very glad of that, for then I can call you motherinstead of sister.  For a long time I have wanted a mother,just like other boys.  But how did you grow so quickly?""","""I am very glad of that, for then I can call you motherinstead of siste"
928,"""That's a secret!""","""That's a"
929,"""Tell it to me.  I also want to grow a little.  Look at me!I have never grown higher than a penny's worth of cheese.""","""Tell it to me.  I also want to grow "
930,"""But you can't grow,"" answered the Fairy.","""But you can't grow,"" "
931,"""Why not?""","""Why n"
932,"""Because Marionettes never grow.  They are born Marionettes,they live Marionettes, and they die Marionettes.""","""Because Marionette"
933,"""Oh, I'm tired of always being a Marionette!"" cried Pinocchio disgustedly.""It's about time for me to grow into a man as everyone else does.""","""Oh, I'm tired of always being a Marionette!"" cried Pinocchio disguste"
934,"""And you will if you deserve it--""","""And you will if you dese"
935,"""Really?  What can I do to deserve it?""","""Really?  What can I do to deserve it?"
936,"""It's a very simple matter.  Try to act like a well-behaved child.""",""""
937,"""Don't you think I do?""","""Do"
938,"""Far from it!  Good boys are obedient, and you, on the contrary--""","""Far from i"
939,"""And I never obey.""","""And I "
940,"""Good boys love study and work, but you--""","""Good boy"
941,"""And I, on the contrary, am a lazy fellow and a tramp all year round.""","""And I, on the contrary, am a lazy fellow and a "
942,"""Good boys always tell the truth.""","""Good boys always tell the truth"
943,"""And I always tell lies.""","""And I al"
944,"""Good boys go gladly to school.""","""Good boys go gladly to"
945,"""And I get sick if I go to school.  From now on I'll be different.""","""And I get sick if I go to school.  From now on I'll be differ"
946,"""Do you promise?""","""Do you promis"
947,"""I promise.  I want to become a good boy and be a comfort to my father.Where is my poor father now?""","""I"
948,"""I do not know.""","""I do not kno"
949,"""Will I ever be lucky enough to find him and embrace him once more?""","""Will I ever be lucky enough to find him and embrace him onc"
950,"""I think so.  Indeed, I am sure of it.""","""I think so.  Indeed, I a"
951,"At this answer, Pinocchio's happiness was very great.He grasped the Fairy's hands and kissed them so hard thatit looked as if he had lost his head.  Then lifting his face,he looked at her lovingly and asked:  ""Tell me, little Mother,it isn't true that you are dead, is it?""","At this answer, Pinocchio's happiness was very great.He grasped the Fairy's hands and kissed them so hard thatit looked as if he had lost his head.  Then lifting his face,he looked at her lovingly and asked:  ""Tell me, little Mother,it isn't true that you are dead,"
952,"""It doesn't seem so,"" answered the Fairy, smiling.","""It doesn't seem so,"" answered the Fairy, smil"
953,"""If you only knew how I suffered and how I wept when I read `Here lies--'""","""If you only knew how I suffered and how I wept when"
954,"""I know it, and for that I have forgiven you.  The depthof your sorrow made me see that you have a kind heart.There is always hope for boys with hearts such as yours,though they may often be very mischievous.  This is thereason why I have come so far to look for you.  From nowon, I'll be your own little mother.""","""I know it, and for that I have forgiven you.  The depthof your sorrow made me see that you have a kind heart.There is always hope for boys with hearts such as yours,though they may often be very mischievous.  This is thereason why I have come so far to look "
955,"""Oh!  How lovely!"" cried Pinocchio, jumping with joy.","""Oh!  How lovely!"" cried Pinocchio, jumping with "
956,"""You will obey me always and do as I wish?""","""You will obey me al"
957,"""Gladly, very gladly, more than gladly!""","""Gladly, very gladly, mo"
958,"""Beginning tomorrow,"" said the Fairy, ""you'll go to school every day.""","""Beginning tomorrow,"" said the Fairy, ""you'll"
959,Pinocchio's face fell a little.,Pinocchio's f
960,"""Then you will choose the trade you like best.""","""Then you will choose the trade you like bes"
961,Pinocchio became more serious.,Pinocchio became more seri
962,"""What are you mumbling to yourself?"" asked the Fairy.","""What are you mumbling to yourself?"" asked the Fai"
963,"""I was just saying,"" whined the Marionette in a whisper,""that it seems too late for me to go to school now.""","""I was"
964,"""No, indeed.  Remember it is never too late to learn.""","""No, inde"
965,"""But I don't want either trade or profession.""","""But I don't want ei"
966,"""Why?""","""Why"
967,"""Because work wearies me!""","""Because "
968,"""My dear boy,"" said the Fairy, ""people who speak asyou do usually end their days either in a prison or in ahospital.  A man, remember, whether rich or poor, shoulddo something in this world.  No one can find happinesswithout work.  Woe betide the lazy fellow!  Laziness is aserious illness and one must cure it immediately; yes, evenfrom early childhood.  If not, it will kill you in the end.""","""My dear boy,"" said the Fairy, ""peo"
969,"These words touched Pinocchio's heart.  He liftedhis eyes to his Fairy and said seriously:""I'll work; I'll study; I'll do all you tell me.After all, the life of a Marionette has grown very tiresometo me and I want to become a boy, no matter how hard it is.You promise that, do you not?""",These words touched Pinocchio's heart.  He li
970,"""Yes, I promise, and now it is up to you.""","""Yes, I promise, a"
971,CHAPTER 26,CHAPTER 
972,Pinocchio goes to the seashore with his friendsto see the Terrible Shark,Pinocchio goes to the seashore with his 
973,"In the morning, bright and early, Pinocchio started for school.","In the morning, bright and early,"
974,"Imagine what the boys said when they saw a Marionetteenter the classroom!  They laughed until they cried.  Everyoneplayed tricks on him.  One pulled his hat off, anothertugged at his coat, a third tried to paint a mustache underhis nose.  One even attempted to tie strings to his feet andhis hands to make him dance.",Imagine what the boys said
975,"For a while Pinocchio was very calm and quiet.  Finally,however, he lost all patience and turning to his tormentors,he said to them threateningly:","For a while Pinocchio was very calm and quiet.  Finally,however, he lost all patience and turning to his tormentors,he said to th"
976,"""Careful, boys, I haven't come here to be made fun of.I'll respect you and I want you to respect me.""","""Careful, boys, I haven't come here to be mad"
