,good,bad
435,"""Unfortunately the Cat received a telegram whichsaid that his first-born was suffering from chilblainsand was on the point of death.  He could not even waitto say good-by to you.""","""Unfortunately the Cat received a telegram whichsaid that his first-born was suffering from chilblainsand was on the point of death.  He could not even waitto say good-by to "
436,"""Did they pay for the supper?""","""Did they pay for the su"
437,"""How could they do such a thing?  Being people ofgreat refinement, they did not want to offend you sodeeply as not to allow you the honor of paying the bill.""","""How could they"
438,"""Too bad!  That offense would have been more thanpleasing to me,"" said Pinocchio, scratching his head.","""Too bad!  That offense would have been more tha"
439,"""Where did my good friends say they would wait for me?"" he added.","""Where did my good friends say they"
440,"""At the Field of Wonders, at sunrise tomorrow morning.""","""At the Field of Wonders, at "
441,Pinocchio paid a gold piece for the three suppers andstarted on his way toward the field that was to makehim a rich man.,Pinocchio paid a gold pie
442,"He walked on, not knowing where he was going, forit was dark, so dark that not a thing was visible.  Roundabout him, not a leaf stirred.  A few bats skimmed hisnose now and again and scared him half to death.  Onceor twice he shouted, ""Who goes there?"" and the far-awayhills echoed back to him, ""Who goes there?  Who goesthere?  Who goes. . . ?""","He walked on, not knowing where he was going, forit was dark, so dark that not a thing was visible.  Roundabout him, not a leaf stirred.  A few bats skimmed hisnose now and again and scared him half to death.  Onceor twice he shouted, ""Who goes there?"" and the far-awayhills"
443,"As he walked, Pinocchio noticed a tiny insectglimmering on the trunk of a tree, a small being that glowedwith a pale, soft light.","As he walked, Pinocchio noticed a tiny insectglimmering on the trunk of a tree, "
444,"""Who are you?"" he asked.","""Who are you?"" he asked"
445,"""I am the ghost of the Talking Cricket,"" answered thelittle being in a faint voice that sounded as if it came froma far-away world.","""I am the ghost of the Talking Cricket,"" answered theli"
446,"""What do you want?"" asked the Marionette.","""What do y"
447,"""I want to give you a few words of good advice.Return home and give the four gold pieces you haveleft to your poor old father who is weeping because hehas not seen you for many a day.""","""I want to gi"
448,"""Tomorrow my father will be a rich man, for thesefour gold pieces will become two thousand.""","""Tomorrow my father will be a rich man, for thesefour gold pie"
449,"""Don't listen to those who promise you wealth overnight,my boy.  As a rule they are either fools or swindlers!Listen to me and go home.""","""Don't listen to those who promise you wealth overnight,my boy.  As a rule they are either fools or swi"
450,"""But I want to go on!""","""But I want to go"
451,"""The hour is late!""",""""
452,"""I want to go on.""","""I"
453,"""The night is very dark.""","""The night is very "
454,"""I want to go on.""","""I"
455,"""The road is dangerous.""","""The road is dange"
456,"""I want to go on.""","""I want to go on"
457,"""Remember that boys who insist on having their own way,sooner or later come to grief.""","""Remember that boys who insist on having their own way,sooner or l"
458,"""The same nonsense.  Good-by, Cricket.""","""The same nonsense.  Good-by, Cric"
459,"""Good night, Pinocchio, and may Heaven preserve youfrom the Assassins.""","""Good night, Pinocchio, and may Heaven preserve youfrom the Assassi"
460,"There was silence for a minute and the light of theTalking Cricket disappeared suddenly, just as if someonehad snuffed it out.  Once again the road was plungedin darkness.",There was silence for a minute and the lig
461,CHAPTER 14,CHAPTER 1
462,"Pinocchio, not having listened to the good adviceof the Talking Cricket, falls into the hands of the Assassins","Pinocchio, not having listened to the good adviceof the Talking Cricket, falls into the "
463,"""Dear, oh, dear!  When I come to think of it,"" said theMarionette to himself, as he once more set out on hisjourney, ""we boys are really very unlucky.  Everybodyscolds us, everybody gives us advice, everybody warns us.If we were to allow it, everyone would try to be fatherand mother to us; everyone, even the Talking Cricket.Take me, for example.  Just because I would not listen tothat bothersome Cricket, who knows how many misfortunesmay be awaiting me!  Assassins indeed!  At leastI have never believed in them, nor ever will.  To speaksensibly, I think assassins have been invented by fathersand mothers to frighten children who want to run awayat night.  And then, even if I were to meet them onthe road, what matter?  I'll just run up to them, and say,`Well, signori, what do you want?  Remember that youcan't fool with me!  Run along and mind your business.'At such a speech, I can almost see those poor fellowsrunning like the wind.  But in case they don't run away,I can always run myself. . .""","""Dear, oh, dear!  When I come to think of it,"" said theMarionette to himself, as he once more set out on hisjourney, ""we boys are really very unlucky.  Everybodyscolds us, everybody gives us advice, everybody warns us.If we were to allow it, everyone would try to be fatherand mother to us; everyone, even the Talking Cricket.Take me, for example.  Just because I would not listen tothat bothersome Cricket, who knows how many misfortunesmay be awaiting me!  Assassins indeed!  At leastI have never believed in them, nor ever will.  To speaksensibly, I think assassins have been invented by fathersand mothers to frighten children who want to run awayat night.  And then, even if I were to meet them onth"
464,"Pinocchio was not given time to argue any longer, for he thoughthe heard a slight rustle among the leaves behind him.","Pinocchio was not given time to argue any longer, for he thoughthe heard a "
465,"He turned to look and behold, there in the darknessstood two big black shadows, wrapped from head to footin black sacks.  The two figures leaped toward him assoftly as if they were ghosts.",He turned to look and behold
466,"""Here they come!"" Pinocchio said to himself, and,not knowing where to hide the gold pieces, he stuck allfour of them under his tongue.","""Here they co"
467,"He tried to run away, but hardly had he taken a step,when he felt his arms grasped and heard two horrible,deep voices say to him:  ""Your money or your life!""","He tried to run away, but hardly had he tak"
468,"On account of the gold pieces in his mouth, Pinocchiocould not say a word, so he tried with head and handsand body to show, as best he could, that he was only apoor Marionette without a penny in his pocket.","On account of the gold pieces in his mouth, Pinocchiocould not say a word, so he tried with head and handsand body to show, as best he could, that he was only apoor Marionette without a penny in "
469,"""Come, come, less nonsense, and out with your money!""cried the two thieves in threatening voices.","""Come, come, less nonsense, and o"
470,"Once more, Pinocchio's head and hands said, ""I haven'ta penny.""","Once more, Pinocchio's head an"
471,"""Out with that money or you're a dead man,"" said thetaller of the two Assassins.","""Out with that money or you're a"
472,"""Dead man,"" repeated the other.","""Dead man"
473,"""And after having killed you, we will kill your father also.""","""And after hav"
474,"""Your father also!""","""Your fa"
475,"""No, no, no, not my Father!"" cried Pinocchio, wild with terror;but as he screamed, the gold pieces tinkled together in his mouth.","""No, no, no, "
476,"""Ah, you rascal!  So that's the game!  You have themoney hidden under your tongue.  Out with it!""","""Ah, you rascal!  So that's the game!  You have themoney hidden under your ton"
477,But Pinocchio was as stubborn as ever.,But Pi
478,"""Are you deaf?  Wait, young man, we'll get it fromyou in a twinkling!""","""Are you deaf?  Wait, young man, we'll get it"
479,"One of them grabbed the Marionette by the nose andthe other by the chin, and they pulled him unmercifullyfrom side to side in order to make him open his mouth.",One of them grabbed the Marionette by the nose andthe 
480,All was of no use.  The Marionette's lips might havebeen nailed together.  They would not open.,All was of no use. 
481,"In desperation the smaller of the two Assassins pulledout a long knife from his pocket, and tried to pry Pinocchio'smouth open with it.","In desperation the smaller of the two Assassins pulledout a long knife from his pocket, and "
482,"Quick as a flash, the Marionette sank his teeth deepinto the Assassin's hand, bit it off and spat it out.  Fancyhis surprise when he saw that it was not a hand, but acat's paw.","Quick as a flash, the Marionette sank his teeth deepinto the Assassin's hand, bit it off and spat it out.  Fancyhis surprise when "
483,"Encouraged by this first victory, he freed himself fromthe claws of his assailers and, leaping over the bushesalong the road, ran swiftly across the fields.  His pursuerswere after him at once, like two dogs chasing a hare.","Encouraged by this first victory, he freed himself fromthe claws of his assailers and, leaping over the bushesalong the road, ran swiftly across the fields.  His pursuerswere "
484,"After running seven miles or so, Pinocchio was well-nigh exhausted.  Seeing himself lost, he climbed up agiant pine tree and sat there to see what he could see.The Assassins tried to climb also, but they slipped and fell.","After running seven miles or so, Pinocchio was well-nigh exhausted.  Seeing himself lo"
485,"Far from giving up the chase, this only spurred them on.They gathered a bundle of wood, piled it up at thefoot of the pine, and set fire to it.  In a twinkling thetree began to sputter and burn like a candle blown bythe wind.  Pinocchio saw the flames climb higher andhigher.  Not wishing to end his days as a roastedMarionette, he jumped quickly to the ground and off he went,the Assassins close to him, as before.",Far from giving 
486,"Dawn was breaking when, without any warning whatsoever,Pinocchio found his path barred by a deep pool fullof water the color of muddy coffee.","Dawn was breaking when, without any "
487,"What was there to do?  With a ""One, two, three!""he jumped clear across it.  The Assassins jumped also,but not having measured their distance well--splash!!!--they fell right into the middle of the pool.  Pinocchiowho heard the splash and felt it, too, cried out, laughing,but never stopping in his race:","What was there to do?  With a ""One, two, three!""he jumped clear across it.  The Assassins jumped also,but not having measured their distance well--splash!!!--they fell right into the middle of the pool.  Pinocchiowho heard the splash and felt it, too, cried o"
488,"""A pleasant bath to you, signori!""","""A plea"
489,"He thought they must surely be drowned and turnedhis head to see.  But there were the two somber figuresstill following him, though their black sacks were drenchedand dripping with water.",He thought they must surely be drowned and turnedhis head to se
490,CHAPTER 15,CH
491,"The Assassins chase Pinocchio, catch him,and hang him to the branch of a giant oak tree",The 
492,"As he ran, the Marionette felt more and more certain thathe would have to give himself up into the hands of hispursuers.  Suddenly he saw a little cottage gleaming whiteas the snow among the trees of the forest.","As he ran, the Marionette felt more and more certain thathe would have to give himself up into the hands of hispursuers.  Suddenly he saw a li"
493,"""If I have enough breath left with which to reach thatlittle house, I may be saved,"" he said to himself.","""If I have enough breath left with which to reach thatlittle house, I may be saved,"" he said to hims"
494,"Not waiting another moment, he darted swiftly throughthe woods, the Assassins still after him.","Not waiting another moment, he "
495,"After a hard race of almost an hour, tired and out ofbreath, Pinocchio finally reached the door of the cottageand knocked.  No one answered.","After a hard race of almost an hour, ti"
496,"He knocked again, harder than before, for behind himhe heard the steps and the labored breathing of hispersecutors.  The same silence followed.","He knocked again, harder than before, for behind himhe heard the steps and the labored breathing of "
497,"As knocking was of no use, Pinocchio, in despair,began to kick and bang against the door, as if he wantedto break it.  At the noise, a window opened and a lovelymaiden looked out.  She had azure hair and a face whiteas wax.  Her eyes were closed and her hands crossed onher breast.  With a voice so weak that it hardly could beheard, she whispered:","As knocking was of no use, Pinocchio, in despair,began to kick and bang against the door, as if he wantedto break it.  At the noise, a window opened and a lovelymaiden looked out.  She had azure hair and a face whiteas wax.  Her eyes were closed and her hands crossed onher breast.  With a "
498,"""No one lives in this house.  Everyone is dead.""","""No one lives i"
499,"""Won't you, at least, open the door for me?""cried Pinocchio in a beseeching voice.","""Won't you, at least, open the door for me?""cried Pinocchio in a beseeching v"
500,"""I also am dead.""",""""
501,"""Dead?  What are you doing at the window, then?""","""Dead?  What are y"
502,"""I am waiting for the coffin to take me away.""","""I am waiting for the coffi"
503,"After these words, the little girl disappeared and thewindow closed without a sound.","After these words, the little girl disappeared and thewindow cl"
504,"""Oh, Lovely Maiden with Azure Hair,"" criedPinocchio, ""open, I beg of you.  Take pity on a poor boy whois being chased by two Assass--""","""Oh, Lovely Maiden with Azure Hair,"
505,"He did not finish, for two powerful hands grasped himby the neck and the same two horrible voices growledthreateningly: ""Now we have you!""","He did not finish, for two powerful "
506,"The Marionette, seeing death dancing before him,trembled so hard that the joints of his legs rattled andthe coins tinkled under his tongue.",T
507,"""Well,"" the Assassins asked, ""will you open yourmouth now or not?  Ah!  You do not answer?  Very well,this time you shall open it.""","""Well,"" the Assassins asked, ""will you open yourmouth now or not?  Ah!  You do not answer?  Very "
508,"Taking out two long, sharp knives, they struck twoheavy blows on the Marionette's back.","Taking out two long, sharp knives, they struck twoheavy blows on"
509,"Happily for him, Pinocchio was made of very hardwood and the knives broke into a thousand pieces.  TheAssassins looked at each other in dismay, holding thehandles of the knives in their hands.","Happily for him, Pinocchio was made of very hardwood and the knives broke into a thousand pieces.  TheAssas"
510,"""I understand,"" said one of them to the other, ""thereis nothing left to do now but to hang him.""","""I understand,"" said one of them to the other, ""thereis nothing left to do now but to"
511,"""To hang him,"" repeated the other.","""To hang him,"" repea"
512,"They tied Pinocchio's hands behind his shoulders andslipped the noose around his neck.  Throwing the ropeover the high limb of a giant oak tree, they pulled tillthe poor Marionette hung far up in space.",They tied Pinocchio's hands behind his shoulders andslipped the noose around his neck.  Throwing the ropeove
513,"Satisfied with their work, they sat on the grass waitingfor Pinocchio to give his last gasp.  But after three hoursthe Marionette's eyes were still open, his mouth still shutand his legs kicked harder than ever.",Satisfied with their w
514,"Tired of waiting, the Assassins called to him mockingly:""Good-by till tomorrow.  When we return in the morning,we hope you'll be polite enough to let us find youdead and gone and with your mouth wide open.""With these words they went.","Tired of waiting, the Assassins called to him mockingly:""Good-by till tomorrow.  When we return in the morning,we hope you'll be polite enough to let us find youdead and gone and with your mouth"
515,"A few minutes went by and then a wild wind startedto blow.  As it shrieked and moaned, the poor littlesufferer was blown to and fro like the hammer of a bell.The rocking made him seasick and the noose, becomingtighter and tighter, choked him.  Little by little a filmcovered his eyes.","A few minutes went by and then a wild wind startedto blow.  As it shrieked and moaned, the poor littlesuffer"
516,"Death was creeping nearer and nearer, and the Marionettestill hoped for some good soul to come to his rescue,but no one appeared.  As he was about to die, he thoughtof his poor old father, and hardly conscious of what hewas saying, murmured to himself:","Death was creeping nearer and nearer, and the Marionettestill hoped for some good soul to come to his rescue,but no one appeared.  As he was about to die, h"
517,"""Oh, Father, dear Father!  If you were only here!""","""Oh, Father, dear "
518,"These were his last words.  He closed his eyes, openedhis mouth, stretched out his legs, and hung there, as ifhe were dead.","These were his last words.  He closed his eyes, openedhis mouth, stretched out his legs, and hung "
519,CHAPTER 16,CH
520,"The Lovely Maiden with Azure Hair sends for the poor Marionette,puts him to bed, and calls three Doctors to tell her if Pinocchiois dead or alive","The Lovely Maiden with Azure Hair sends for the poor Marionette,puts him to bed, and calls three Doctors t"
521,"If the poor Marionette had dangled there much longer,all hope would have been lost.  Luckily for him, theLovely Maiden with Azure Hair once again looked out ofher window.  Filled with pity at the sight of the poor littlefellow being knocked helplessly about by the wind, sheclapped her hands sharply together three times.","If the poor Marionette had dangled there much longer,all hope would have been lost.  Luckily for him, theLovely Maiden with Azure Hair once again looked out "
522,"At the signal, a loud whirr of wings in quick flight washeard and a large Falcon came and settled itself on thewindow ledge.","At the signal, a loud whirr of wings in "
523,"""What do you command, my charming Fairy?"" asked the Falcon,bending his beak in deep reverence (for it mustbe known that, after all, the Lovely Maiden with AzureHair was none other than a very kind Fairy who had lived,for more than a thousand years, in the vicinity of the forest).","""What do you command, my charming Fairy?"" asked the Falcon,bending his beak in deep reverence (for it mustbe known that, after all, the Lovely Maiden with AzureHair was none other than a very kind Fairy who had lived,for more than a thousand yea"
524,"""Do you see that Marionette hanging from the limbof that giant oak tree?""","""Do you see that Marionette hanging from the limb"
525,"""I see him.""","""I see h"
526,"""Very well.  Fly immediately to him.  With yourstrong beak, break the knot which holds him tied,take him down, and lay him softly on the grassat the foot of the oak.""","""Very well.  Fl"
527,"The Falcon flew away and after two minutes returned,saying, ""I have done what you have commanded.""",The Falcon flew away and after two minutes r
528,"""How did you find him?  Alive or dead?""","""How did you find him?"
529,"""At first glance, I thought he was dead.  But I foundI was wrong, for as soon as I loosened the knot aroundhis neck, he gave a long sigh and mumbled with a faintvoice, `Now I feel better!'""","""At first glance, I thought he was dead.  But I foundI was wrong, for as soon as I loosened the knot aroundhis neck, he gave a long"
530,"The Fairy clapped her hands twice.  A magnificentPoodle appeared, walking on his hind legs just like aman.  He was dressed in court livery.  A tricorn trimmedwith gold lace was set at a rakish angle over a wig of whitecurls that dropped down to his waist.  He wore a jauntycoat of chocolate-colored velvet, with diamond buttons,and with two huge pockets which were always filled withbones, dropped there at dinner by his loving mistress.Breeches of crimson velvet, silk stockings, and low,silver-buckled slippers completed his costume.  His tailwas encased in a blue silk covering, which was to protectit from the rain.","The Fairy clapped her hands twice.  A magnificentPoodle appeared, walking on his hind legs just like aman.  He was dressed in cour"
531,"""Come, Medoro,"" said the Fairy to him.  ""Get mybest coach ready and set out toward the forest.  Onreaching the oak tree, you will find a poor, half-deadMarionette stretched out on the grass.  Lift him uptenderly, place him on the silken cushions of the coach,and bring him here to me.""","""Come, Medoro,"" said the Fairy to him.  ""Get mybest coach ready and set out toward the forest.  Onreaching the oak tree, you will find a poor, hal"
532,"The Poodle, to show that he understood, wagged his silk-covered tailtwo or three times and set off at a quick pace.","The Poodle, to show that "
533,"In a few minutes, a lovely little coach, made of glass,with lining as soft as whipped cream and chocolate pudding,and stuffed with canary feathers, pulled out of thestable.  It was drawn by one hundred pairs of white mice,and the Poodle sat on the coachman's seat and snappedhis whip gayly in the air, as if he were a real coachmanin a hurry to get to his destination.","In a few minutes, a lovely little coach, made of glass,with lining as soft as whipped cream and chocolate pudding,and stuffed with canary feathers, pulled out of thestable.  It was drawn by one hundred pairs of white mice,and the Poodle sat on the coachman's seat and snappedhis whip "
534,"In a quarter of an hour the coach was back.  TheFairy, who was waiting at the door of the house, liftedthe poor little Marionette in her arms, took him to adainty room with mother-of-pearl walls, put him to bed,and sent immediately for the most famous doctors of theneighborhood to come to her.","In a quarter of an hour the coach was back.  TheFairy, who was waiting at the door of the house, liftedthe poor "
535,"One after another the doctors came, a Crow, and Owl,and a Talking Cricket.","One after another the doctors came, a Crow, and O"
536,"""I should like to know, signori,"" said the Fairy, turningto the three doctors gathered about Pinocchio's bed,""I should like to know if this poor Marionette is dead or alive.""","""I should like to know, signori,"" said the Fairy, turningto the three doctor"
537,"At this invitation, the Crow stepped out and feltPinocchio's pulse, his nose, his little toe.Then he solemnly pronounced the following words:","At this invitation, the Crow stepped out and feltPinocchio's pulse, his nose, "
538,"""To my mind this Marionette is dead and gone; but if,by any evil chance, he were not, then that would be asure sign that he is still alive!""","""To my mind this Marionette is dead and gone; but if,by any evil cha"
539,"""I am sorry,"" said the Owl, ""to have to contradictthe Crow, my famous friend and colleague.  To my mindthis Marionette is alive; but if, by any evil chance, hewere not, then that would be a sure sign that he is wholly dead!""","""I am sorry,"" said the Owl, ""to have to contradictthe Crow, my famous friend and colleague.  To my mindthis Marionette is alive; but if, by any evil chance, hewere not, then that would be a sure"
540,"""And do you hold any opinion?"" the Fairy asked the Talking Cricket.","""And d"
541,"""I say that a wise doctor, when he does not know what heis talking about, should know enough to keep his mouth shut.However, that Marionette is not a stranger to me.I have known him a long time!""","""I say that a wise doctor, when he does not know what heis talking about, should know enough to keep his mouth shut.However, that Marionette i"
542,"Pinocchio, who until then had been very quiet,shuddered so hard that the bed shook.","Pinocchio, who until then had been very quiet,shuddered so hard that the "
543,"""That Marionette,"" continued the Talking Cricket,""is a rascal of the worst kind.""","""That Marionette,"" continued the Tal"
544,Pinocchio opened his eyes and closed them again.,Pinocc
545,"""He is rude, lazy, a runaway.""","""He is rude, lazy, a r"
546,Pinocchio hid his face under the sheets.,Pinocchio hid his face under the s
547,"""That Marionette is a disobedient son who is breakinghis father's heart!""","""That Marionette is a disob"
548,"Long shuddering sobs were heard, cries, and deep sighs.Think how surprised everyone was when, on raising the sheets,they discovered Pinocchio half melted in tears!","Long shuddering sobs were heard, cries, and deep sighs.Thi"
549,"""When the dead weep, they are beginning to recover,""said the Crow solemnly.","""When the dead weep, they are beginning to recover,"""
550,"""I am sorry to contradict my famous friend and colleague,""said the Owl, ""but as far as I'm concerned, I think thatwhen the dead weep, it means they do not want to die.""","""I am sorry to contradict my famous friend and colleague,""said the Owl, ""but as far as I'm concerned, I think thatwhen the de"
551,CHAPTER 17,CHAPTER 1
552,"Pinocchio eats sugar, but refuses to take medicine.When the undertakers come for him, he drinks the medicine and feels better.Afterwards he tells a lie and, in punishment, his nose grows longer and longer","Pinocchio eats sugar, but refuses to take medicine.When the undertakers come for him, he drinks the medicine and feels bett"
553,"As soon as the three doctors had left the room, the Fairywent to Pinocchio's bed and, touching him on the forehead,noticed that he was burning with fever.","As soon as the three doctors had left the room, the Fairywent to Pinocchio's bed and, touching him on the forehe"
