,good,bad
0,The Adventures of Pinocchio,The Advent
1,CHAPTER 1,CHA
2,"How it happened that Mastro Cherry, carpenter,found a piece of wood that wept and laughed like a child","How it happened that Mastro Cherry, carpenter,found a piece of wood that wept and laughed lik"
3,Centuries ago there lived--,Centuries ago there li
4,"""A king!"" my little readers will say immediately.","""A king!"" "
5,"No, children, you are mistaken.  Once upon a timethere was a piece of wood.  It was not an expensive pieceof wood.  Far from it.  Just a common block of firewood,one of those thick, solid logs that are put on the fire inwinter to make cold rooms cozy and warm.","No, children, you are mistaken.  Once upon a timethere was a piece of wood.  It was not an expensive pieceof wood.  Far from it.  Just a common block of firewood,on"
6,"I do not know how this really happened, yet the factremains that one fine day this piece of wood found itselfin the shop of an old carpenter.  His real name wasMastro Antonio, but everyone called him Mastro Cherry,for the tip of his nose was so round and red and shinythat it looked like a ripe cherry.","I do not know how this really happened, yet the factremains that one fine day this piece of wood found itselfin the shop of an old carpenter.  His real name wasMastro Antonio, but everyone called him Mastro Cherry,f"
7,"As soon as he saw that piece of wood, Mastro Cherrywas filled with joy.  Rubbing his hands together happily,he mumbled half to himself:","As soon as he saw that piece of wood, Mastro Cherrywas f"
8,"""This has come in the nick of time.  I shall use it tomake the leg of a table.""","""This has come in the nick of time.  I "
9,"He grasped the hatchet quickly to peel off the bark andshape the wood.  But as he was about to give it the firstblow, he stood still with arm uplifted, for he had heard awee, little voice say in a beseeching tone:  ""Please be careful!Do not hit me so hard!""",He grasped the hatchet quickly to peel off the bark andshape the wood.  But as he
10,What a look of surprise shone on Mastro Cherry'sface!  His funny face became still funnier.,What a look of surpri
11,"He turned frightened eyes about the room to find outwhere that wee, little voice had come from and he sawno one! He looked under the bench--no one! He peepedinside the closet--no one! He searched among the shavings--no one! He opened the door to look up and downthe street--and still no one!",He turned frightened eye
12,"""Oh, I see!"" he then said, laughing and scratching his Wig.""It can easily be seen that I only thought I heard the tinyvoice say the words! Well, well--to work once more.""","""Oh, I see!"" he then said, laughing and scratching his Wig.""It can easily be seen t"
13,He struck a most solemn blow upon the piece of wood.,He struck a most solemn blow upon the pi
14,"""Oh, oh!  You hurt!"" cried the same far-away little voice.","""Oh, oh!  Yo"
15,"Mastro Cherry grew dumb, his eyes popped out of hishead, his mouth opened wide, and his tongue hung downon his chin.","Mastro Cherry grew dumb, his eyes popped out of hishead, his mouth opened wide, and his tongue hung downon "
16,"As soon as he regained the use of his senses, he said,trembling and stuttering from fright:",As 
17,"""Where did that voice come from, when there is noone around?  Might it be that this piece of wood haslearned to weep and cry like a child?  I can hardlybelieve it.  Here it is--a piece of common firewood, goodonly to burn in the stove, the same as any other.  Yet--might someone be hidden in it?  If so, the worse for him.I'll fix him!""","""Where did that voice come from, when there is noone around?  Might it be that this piece of wood haslearned to weep and cry like a child?  I can hardlybelieve it.  Here it is--a piece of common firewood, goodonly to burn in the stove, the same as any other.  Yet--mig"
18,"With these words, he grabbed the log with both handsand started to knock it about unmercifully.  He threw itto the floor, against the walls of the room, and even upto the ceiling.","With these words, he grabbed the log with "
19,He listened for the tiny voice to moan and cry.He waited two minutes--nothing; five minutes--nothing;ten minutes--nothing.,He listened for the tiny voice to moan and cry.He waited two minutes--nothing; five minutes--nothing;ten minutes--n
20,"""Oh, I see,"" he said, trying bravely to laugh andruffling up his wig with his hand.  ""It can easily be seenI only imagined I heard the tiny voice!  Well, well--towork once more!""","""Oh, I see,"" he said, trying bravely to laugh andruffling up h"
21,"The poor fellow was scared half to death, so he triedto sing a gay song in order to gain courage.",The poor fe
22,"He set aside the hatchet and picked up the plane tomake the wood smooth and even, but as he drew it toand fro, he heard the same tiny voice.  This time it giggledas it spoke:",He set aside the hatchet and picked up the plane tomake the wood
23,"""Stop it!  Oh, stop it!  Ha, ha, ha! You tickle my stomach.""","""Stop it!  Oh, stop it!  Ha, ha, ha! You tickle my stomac"
24,"This time poor Mastro Cherry fell as if shot.  Whenhe opened his eyes, he found himself sitting on the floor.",This time poor Mast
25,His face had changed; fright had turned even the tip ofhis nose from red to deepest purple.,His face had changed; fright had turned even the tip ofhis nose from red to d
26,CHAPTER 2,CHAPTER 
27,"Mastro Cherry gives the piece of wood to his friend Geppetto,who takes it to make himself a Marionette that will dance,fence, and turn somersaults","Mastro Cherry gives the piece of wood to his friend Geppetto,who takes it to make himself a Marionette that will dance,fence, an"
28,"In that very instant, a loud knock sounded on the door.""Come in,"" said the carpenter, not having an atom ofstrength left with which to stand up.","In that very instant, a lo"
29,"At the words, the door opened and a dapper little oldman came in.  His name was Geppetto, but to the boys ofthe neighborhood he was Polendina,[1] on account of thewig he always wore which was just the color of yellow corn.",At t
30,[1] Cornmeal mush,[
31,Geppetto had a very bad temper.  Woe to the one whocalled him Polendina!  He became as wild as a beast andno one could soothe him.,Geppetto had a very bad temper.  Woe to the one whocalled him Polendina!  He bec
32,"""Good day, Mastro Antonio,"" said Geppetto.  ""Whatare you doing on the floor?""","""Good day, Mastro Antonio,"" said Geppetto.  ""Whatare y"
33,"""I am teaching the ants their A B C's.""","""I am tea"
34,"""Good luck to you!""","""Good "
35,"""What brought you here, friend Geppetto?""","""What brought yo"
36,"""My legs.  And it may flatter you to know, MastroAntonio, that I have come to you to beg for a favor.""","""My legs.  And it may flatter you to know, MastroAntonio, that I have come to "
37,"""Here I am, at your service,"" answered the carpenter,raising himself on to his knees.","""Here"
38,"""This morning a fine idea came to me.""","""T"
39,"""Let's hear it.""","""Let's"
40,"""I thought of making myself a beautiful woodenMarionette.  It must be wonderful, one that will be able todance, fence, and turn somersaults.  With it I intend to goaround the world, to earn my crust of bread and cup ofwine.  What do you think of it?""","""I thought of making myself a beautiful woodenMarionette.  It must be wonder"
41,"""Bravo, Polendina!"" cried the same tiny voice whichcame from no one knew where.","""Bravo, Polendina!"" cried the same tiny voice whichcame"
42,"On hearing himself called Polendina, Mastro Geppettoturned the color of a red pepper and, facing the carpenter,said to him angrily:","On hearing himself called Polendina, Mastro Geppettoturned the color of a red pepper and, facing the carpenter,said t"
43,"""Why do you insult me?""","""Wh"
44,"""Who is insulting you?""","""Who is in"
45,"""You called me Polendina.""","""You called me P"
46,"""I did not.""","""I did n"
47,"""I suppose you think _I_ did!  Yet I KNOW it was you.""","""I suppos"
48,"""No!""","""No!"
49,"""Yes!""",""""
50,"""No!""","""N"
51,"""Yes!""",""""
52,"And growing angrier each moment, they went fromwords to blows, and finally began to scratch and bite andslap each other.","And growing angrier each moment, they went fromwords to blows, and finally began to s"
53,"When the fight was over, Mastro Antonio had Geppetto'syellow wig in his hands and Geppetto found the carpenter'scurly wig in his mouth.","When the fight was over, Mastro Antonio had Geppetto'syellow wig in his hands and Geppetto f"
54,"""Give me back my wig!"" shouted Mastro Antonio in a surly voice.","""G"
55,"""You return mine and we'll be friends.""","""You return mine and we'll "
56,"The two little old men, each with his own wig back onhis own head, shook hands and swore to be good friendsfor the rest of their lives.","The two little old men, each with his own wig back onhis own head, shook hands and swore to be good friendsfor the rest "
57,"""Well then, Mastro Geppetto,"" said the carpenter, toshow he bore him no ill will, ""what is it you want?""","""Well then, Mastro Geppetto,"" said the carpenter, toshow he bore him no ill will, ""what i"
58,"""I want a piece of wood to make a Marionette.  Will you give it to me?""","""I want a piece of wood to make a Marionette.  Will you give it to "
59,"Mastro Antonio, very glad indeed, went immediatelyto his bench to get the piece of wood which had frightenedhim so much.  But as he was about to give it to his friend,with a violent jerk it slipped out of his hands and hitagainst poor Geppetto's thin legs.",Mastro Antonio
60,"""Ah!  Is this the gentle way, Mastro Antonio, in whichyou make your gifts?  You have made me almost lame!""","""Ah!  Is this the gentle way, M"
61,"""I swear to you I did not do it!""","""I swear to you I did no"
62,"""It was _I_, of course!""","""It was _I_, "
63,"""It's the fault of this piece of wood.""","""It's t"
64,"""You're right; but remember you were the one to throw it at my legs.""","""You're right; but remember you were the one to"
65,"""I did not throw it!""","""I did n"
66,"""Liar!""","""Liar!"
67,"""Geppetto, do not insult me or I shall call you Polendina.""","""Geppetto, do not insult me or I shall call you"
68,"""Idiot.""","""Idiot"
69,"""Polendina!""","""Polend"
70,"""Donkey!""","""Do"
71,"""Polendina!""","""Po"
72,"""Ugly monkey!""","""Ugly monkey!"
73,"""Polendina!""","""Polendina"
74,"On hearing himself called Polendina for the third time,Geppetto lost his head with rage and threw himself uponthe carpenter.  Then and there they gave each other asound thrashing.","On hearing himself called Polendina for the third time,Geppetto lost his head with rage and threw himself uponthe carpenter.  Then and there they gave each other asound thrashin"
75,"After this fight, Mastro Antonio had two more scratcheson his nose, and Geppetto had two buttons missing fromhis coat.  Thus having settled their accounts, they shookhands and swore to be good friends for the rest of their lives.","After this fight, Mastro Antonio had two more scratcheson his nose, and Geppetto had two button"
76,"Then Geppetto took the fine piece of wood,thanked Mastro Antonio, and limped away toward home.","Then Geppetto took the fine piece of wood,thanked M"
77,CHAPTER 3,CHA
78,"As soon as he gets home, Geppetto fashions the Marionetteand calls it Pinocchio.  The first pranks of the Marionette","As soon as he gets home, Geppetto fashions the Marionetteand calls it Pinocchio.  Th"
79,"Little as Geppetto's house was, it was neat andcomfortable.  It was a small room on the ground floor, with atiny window under the stairway.  The furniture could nothave been much simpler:  a very old chair, a rickety oldbed, and a tumble-down table.  A fireplace full of burninglogs was painted on the wall opposite the door.  Over thefire, there was painted a pot full of something which keptboiling happily away and sending up clouds of what lookedlike real steam.","Little as Geppetto's house was, it was neat andcomfortable.  It was a small room on the ground floor, with atiny window under the stairway.  The furniture could nothave been much simpler:  a very old chair, a rickety oldbed, and a tumble-down table.  A fireplace full of burninglogs was painted on the wall opposite the door.  Over thefire, there was painted a pot ful"
80,"As soon as he reached home, Geppetto took his toolsand began to cut and shape the wood into a Marionette.","As soon as he reached home, Geppetto took his toolsand b"
81,"""What shall I call him?"" he said to himself.  ""I thinkI'll call him PINOCCHIO.  This name will make his fortune.I knew a whole family of Pinocchi once--Pinocchio thefather, Pinocchia the mother, and Pinocchi the children--and they were all lucky.  The richest of them begged forhis living.""","""What shall I call him?"" he said to himself.  ""I thinkI'll call him PINOCCHIO.  Th"
82,"After choosing the name for his Marionette, Geppettoset seriously to work to make the hair, the forehead, theeyes.  Fancy his surprise when he noticed that these eyesmoved and then stared fixedly at him.  Geppetto, seeingthis, felt insulted and said in a grieved tone:","After choosing the name for his Marionette, Geppettoset seriously to work to make the hair, the forehead, theeyes.  Fancy his surprise when he noticed that these eyesmoved and then stared fixedly at him.  Geppetto, seeingthis, felt insulted and"
83,"""Ugly wooden eyes, why do you stare so?""","""Ug"
84,There was no answer.,The
85,"After the eyes, Geppetto made the nose, which beganto stretch as soon as finished.  It stretched and stretchedand stretched till it became so long, it seemed endless.","After the eyes, Geppetto made the nose, which beganto stretch as soon as finished.  It stretched a"
86,"Poor Geppetto kept cutting it and cutting it, but themore he cut, the longer grew that impertinent nose.  Indespair he let it alone.","Poor Geppetto kept cutting it and cutting it, but themore he cut, the longer gre"
87,Next he made the mouth.,Next he mad
88,No sooner was it finished than it began to laugh andpoke fun at him.,No sooner was
89,"""Stop laughing!"" said Geppetto angrily; but he mightas well have spoken to the wall.","""Stop laughing!"" s"
90,"""Stop laughing, I say!"" he roared in a voice of thunder.","""Stop laughing, I say!"" he roared in a voice of thu"
91,"The mouth stopped laughing, but it stuck out a long tongue.",The mouth stopp
92,"Not wishing to start an argument, Geppetto madebelieve he saw nothing and went on with his work.After the mouth, he made the chin, then the neck, theshoulders, the stomach, the arms, and the hands.",Not 
93,"As he was about to put the last touches on the fingertips, Geppetto felt his wig being pulled off.  He glancedup and what did he see?  His yellow wig was in the Marionette'shand.  ""Pinocchio, give me my wig!""","As he was about to put the last touches on the fingertips, Geppe"
94,"But instead of giving it back, Pinocchio put it on hisown head, which was half swallowed up in it.",But instead of 
95,"At that unexpected trick, Geppetto became very sadand downcast, more so than he had ever been before.","At that unexpected trick, Geppetto became very sadand downcast, more so tha"
96,"""Pinocchio, you wicked boy!"" he cried out.  ""You arenot yet finished, and you start out by being impudent toyour poor old father.  Very bad, my son, very bad!""","""Pinocchio, you wicked boy!"" he cried out.  ""You arenot yet finished, and you start out by being impudent toyour poor old father.  Very bad, "
97,And he wiped away a tear.,And
98,"The legs and feet still had to be made.  As soon as theywere done, Geppetto felt a sharp kick on the tip of his nose.",The legs and
99,"""I deserve it!"" he said to himself.  ""I should have thoughtof this before I made him.  Now it's too late!""","""I deserve it!"" he sa"
100,He took hold of the Marionette under the arms and puthim on the floor to teach him to walk.,He took hold of the Marionette
101,"Pinocchio's legs were so stiff that he could not movethem, and Geppetto held his hand and showed him how toput out one foot after the other.",P
102,"When his legs were limbered up, Pinocchio startedwalking by himself and ran all around the room.  He cameto the open door, and with one leap he was out into thestreet.  Away he flew!","When his legs were limbered up, Pinocchio startedwalking by himself and ran all around the room"
103,"Poor Geppetto ran after him but was unable to catchhim, for Pinocchio ran in leaps and bounds, his twowooden feet, as they beat on the stones of the street,making as much noise as twenty peasants in wooden shoes.","Poor Geppetto ran after him but was unable to catchhim, for Pinocchio ran in leaps and bounds, his t"
104,"""Catch him!  Catch him!"" Geppetto kept shouting.But the people in the street, seeing a wooden Marionetterunning like the wind, stood still to stare and to laughuntil they cried.","""Catch him!  Catch him!"" Geppetto kept shouting.But the people in the street, seeing a wooden Marionetterunning like the wi"
105,"At last, by sheer luck, a Carabineer[2] happenedalong, who, hearing all that noise, thought that it mightbe a runaway colt, and stood bravely in the middle of thestreet, with legs wide apart, firmly resolved to stop it andprevent any trouble.","At last, by sheer luck, a Carabineer[2] happenedalong, who, hearing all that noise, thought that it mightbe a runaway colt, and stood bravely in the middle of thestreet, with "
106,[2] A military policeman,[2] A mili
107,"Pinocchio saw the Carabineer from afar and tried hisbest to escape between the legs of the big fellow, butwithout success.",Pinocchio saw the Carabineer from 
108,The Carabineer grabbed him by the nose (it was anextremely long one and seemed made on purpose for thatvery thing) and returned him to Mastro Geppetto.,The Carabineer grabbed him
109,"The little old man wanted to pull Pinocchio's ears.Think how he felt when, upon searching for them, hediscovered that he had forgotten to make them!",The little old man wanted to 
110,"All he could do was to seize Pinocchio by the back ofthe neck and take him home.  As he was doing so, he shookhim two or three times and said to him angrily:",All he could do was to seize Pinocchio 
111,"""We're going home now.  When we get home,then we'll settle this matter!""","""We're going home now.  When we get home,then we'll settl"
112,"Pinocchio, on hearing this, threw himself on the groundand refused to take another step.  One person after anothergathered around the two.","Pinocchio, on hearing this, threw h"
113,"Some said one thing, some another.",Some
114,"""Poor Marionette,"" called out a man.  ""I am notsurprised he doesn't want to go home.  Geppetto, no doubt,will beat him unmercifully, he is so mean and cruel!""","""Poor Marionette,"" called out a man.  ""I am notsurprised he doesn't want to go home.  Geppetto, no doubt,will beat him unmercifully, he is so mea"
115,"""Geppetto looks like a good man,"" added another, ""butwith boys he's a real tyrant.  If we leave that poorMarionette in his hands he may tear him to pieces!""","""Geppetto looks like a good man,"" added another, ""butwith boys he's a real tyrant.  If we leave that poorMarionette in his ha"
116,"They said so much that, finally, the Carabineer endedmatters by setting Pinocchio at liberty and draggingGeppetto to prison.  The poor old fellow did not know how todefend himself, but wept and wailed like a child and saidbetween his sobs:","They said so much that, finally, the Carabineer endedmatters by setting Pinocchio at liberty and draggingGeppetto to prison.  The poor old fellow did not know how "
117,"""Ungrateful boy!  To think I tried so hard to make youa well-behaved Marionette!  I deserve it, however!  I shouldhave given the matter more thought.""","""Ungrateful boy!  To think I tried so hard to make youa"
118,"What happened after this is an almost unbelievablestory, but you may read it, dear children, in the chaptersthat follow.","What happened after this is an almost unbelievablestory, but you may read it, dear children, in the chapte"
119,CHAPTER 4,CHA
120,"The story of Pinocchio and the Talking Cricket,in which one sees that bad children do not liketo be corrected by those who know more than they do","The story of Pinocchio and the Talking Cricket,in which one sees that bad children do not liketo be corrected "
121,"Very little time did it take to get poor old Geppetto toprison.  In the meantime that rascal, Pinocchio, free nowfrom the clutches of the Carabineer, was running wildlyacross fields and meadows, taking one short cut afteranother toward home.  In his wild flight, he leaped overbrambles and bushes, and across brooks and ponds, as ifhe were a goat or a hare chased by hounds.","Very little time did it take to get poor old Geppetto toprison.  In the meantime that rascal, Pinocchio, free nowfrom the clutches of the Carabineer, was running wildlyacross fields and meadows, taking one short cut afteranother toward home.  In his wild flight, he leaped overbrambles and bushes, and across brooks and "
122,"On reaching home, he found the house door half open.He slipped into the room, locked the door, and threwhimself on the floor, happy at his escape.","On reaching home, he found the house door half open.He slipped into the room"
123,"But his happiness lasted only a short time, for just thenhe heard someone saying:",But his happiness lasted only a shor
124,"""Cri-cri-cri!""","""Cri"
125,"""Who is calling me?"" asked Pinocchio, greatly frightened.","""Wh"
126,"""I am!""",""""
127,Pinocchio turned and saw a large cricket crawlingslowly up the wall.,Pinocchi
128,"""Tell me, Cricket, who are you?""","""Tell me, Cricket, who are "
129,"""I am the Talking Cricket and I have been living in thisroom for more than one hundred years.""","""I am the Talking Cricket and I have been living in thisroom fo"
130,"""Today, however, this room is mine,"" said the Marionette,""and if you wish to do me a favor, get out now, and don'tturn around even once.""","""Today, however, this room is mine,"" said the Marionette,""and if you wish to do me a favor, get out now, and d"
131,"""I refuse to leave this spot,"" answered the Cricket,""until I have told you a great truth.""","""I refuse to leave this spot,"" answered the Cricke"
132,"""Tell it, then, and hurry.""","""Tell it, the"
133,"""Woe to boys who refuse to obey their parents and runaway from home!  They will never be happy in this world,and when they are older they will be very sorry for it.""","""Woe to b"
134,"""Sing on, Cricket mine, as you please.  What I know is,that tomorrow, at dawn, I leave this place forever.  If Istay here the same thing will happen to me which happensto all other boys and girls.  They are sent to school, andwhether they want to or not, they must study.  As for me,let me tell you, I hate to study!  It's much more fun, I think,to chase after butterflies, climb trees, and steal birds' nests.""","""Sing on, Cricket mine, as you please.  What I know is,that tomorrow, at dawn, I leave this place forever.  If Istay here the same thing will happen to me which happensto all other boys an"
135,"""Poor little silly!  Don't you know that if you go on likethat, you will grow into a perfect donkey and that you'llbe the laughingstock of everyone?""","""Poor little silly!  Don't you know that if you go on likethat, you will grow into a perfect donkey and that you'llbe the laughingst"
136,"""Keep still, you ugly Cricket!"" cried Pinocchio.","""Keep still, you ugly Cricket!"" cri"
137,"But the Cricket, who was a wise old philosopher,instead of being offended at Pinocchio's impudence,continued in the same tone:","But the Cricket, who was a wise old philoso"
138,"""If you do not like going to school, why don't you atleast learn a trade, so that you can earn an honest living?""","""If you do not like going to school, why don't"
139,"""Shall I tell you something?"" asked Pinocchio, who wasbeginning to lose patience.  ""Of all the trades in the world,there is only one that really suits me.""","""Shall I tell you something?"" asked Pinocchio, who wasbeg"
140,"""And what can that be?""","""And wha"
141,"""That of eating, drinking, sleeping, playing, andwandering around from morning till night.""","""That of eating, drinking, sleeping, playing, andwandering a"
142,"""Let me tell you, for your own good, Pinocchio,"" saidthe Talking Cricket in his calm voice, ""that those whofollow that trade always end up in the hospital or in prison.""","""Let me tell you, for your own good, Pinocchio,"" saidthe Talking Cricket in his c"
143,"""Careful, ugly Cricket!  If you make me angry, you'll be sorry!""","""Careful, ugly Cricket!  If you m"
144,"""Poor Pinocchio, I am sorry for you.""","""Poor Pinocchio, I am sorry"
145,"""Why?""","""Why?"
146,"""Because you are a Marionette and, what is much worse,you have a wooden head.""","""Because you are a Marionette and, what is much worse,you have a wooden"
147,"At these last words, Pinocchio jumped up in a fury, tooka hammer from the bench, and threw it with all hisstrength at the Talking Cricket.","At these last words, Pinocchio jumped up in a fury, tooka hammer from the bench, and threw it with all hisstrength at the Talking Crick"
148,"Perhaps he did not think he would strike it.  But, sadto relate, my dear children, he did hit the Cricket, straighton its head.",Perhaps he did not think he woul
149,"With a last weak ""cri-cri-cri"" the poor Cricket fell fromthe wall, dead!",With 
150,CHAPTER 5,CHAPT
151,"Pinocchio is hungry and looks for an egg to cook himself an omelet;but, to his surprise, the omelet flies out of the window","Pinocchio is hungry and looks for an egg to cook himself an omelet;but, to "
